{
  "state": "haryana",
  "name": "Haryana",
  "as_of": "2026",
  "vocabulary": {
    "summary": "The words the Haryana layer adds on top of the shared national vocabulary - the filing-branch roles, the e-Courts CIS mechanics and the local workarounds that a s.138 ('NACT') filing actually runs on in the Panchkula district courts. Drawn from a June 2026 field interview with the filing assistants.",
    "terms": [
      {
        "word": "Filing Assistant",
        "gloss": "The filing-branch clerk who receives a s.138 (NACT) file at the lower-court filing window, checks it for completeness and attestation, enters it in the e-Courts CIS, assigns the NACT filing number and CNR number, records it in the register and hands it to the peon for same-day dispatch to the trial court. A formal court-staff role; some of the practices around it (an emailed PDF copy, parking the police station under 'offence remarks') are self-started and outside any rule.",
        "source": "Punjab & Haryana lower-court filing branch; described by the filing assistants, Panchkula (PUCAR field interview, June 2026)",
        "group": "Court staff",
        "pos": "noun",
        "role": "actor",
        "aka": [
          "filing clerk",
          "filing branch clerk"
        ],
        "sourceNotes": [
          "hr-filing-assistant-2026-06"
        ]
      },
      {
        "word": "Ahlmad",
        "gloss": "The court's record-keeper and reader who receives the filed case in the destination court and takes over registration - entering the full address and any extra-party details - and the subsequent process. A formal establishment role in the North Indian courts; at the filing stage the window hands off to the ahlmad.",
        "source": "Court establishment - the ahlmad (reader / record-keeper) of a trial court; Panchkula filing assistants (PUCAR interview, June 2026)",
        "group": "Court staff",
        "pos": "noun",
        "role": "actor",
        "aka": [
          "ahlamad",
          "reader",
          "record keeper"
        ],
        "sourceNotes": [
          "hr-filing-assistant-2026-06"
        ]
      },
      {
        "word": "Computer room",
        "gloss": "The office that holds the CIS permission to release ('consume' or approve) an e-filed case into the filing branch's queue. The filing assistants have no direct access, so they telephone the computer room each time an e-filing arrives - often ten to fifteen times a day - before they can edit and submit it. An access-control chokepoint rather than a rule.",
        "source": "Local CIS access arrangement, Panchkula district courts (PUCAR interview, June 2026)",
        "group": "Court staff",
        "pos": "noun",
        "role": "actor",
        "aka": [
          "computer branch"
        ],
        "sourceNotes": [
          "hr-filing-assistant-2026-06"
        ]
      },
      {
        "word": "CIS",
        "gloss": "The Case Information System - the national e-Courts case-management software the filing branch works in. The assistant logs in, opens the filing counter, chooses Criminal and then the NACT case type, and enters the party, court-fee and Act details; the system then issues the case numbers. A known pain point is that civil and criminal columns appear together, inviting mis-clicks.",
        "source": "e-Courts Project, Supreme Court e-Committee - Case Information System (CIS)",
        "group": "Systems & records",
        "pos": "noun",
        "role": "procedure",
        "aka": [
          "Case Information System",
          "CIS module"
        ],
        "sourceNotes": [
          "hr-filing-assistant-2026-06"
        ]
      },
      {
        "word": "CNR number",
        "gloss": "The Case Number Record - a nationally unique 16-character identifier the e-Courts system assigns to every case, used to track and search it across courts. In Panchkula the CNR begins 'HRPK' (Haryana, Panchkula). The filing assistant writes it on the file cover alongside the NACT number.",
        "source": "e-Courts Project - CNR (Case Number Record), the nationally unique case identifier",
        "group": "Systems & records",
        "pos": "noun",
        "role": "document",
        "aka": [
          "CNR",
          "case number record"
        ],
        "sourceNotes": [
          "hr-filing-assistant-2026-06"
        ]
      },
      {
        "word": "NACT number",
        "gloss": "The filing number the CIS generates for a Negotiable Instruments Act case. 'NACT' is the e-Courts case-type code for a s.138 cheque-bounce complaint; selecting it under Criminal and submitting the party and Act details produces the NACT number, which is written on the file cover.",
        "source": "e-Courts CIS case-type code for Negotiable Instruments Act s.138 complaints (NACT)",
        "group": "Systems & records",
        "pos": "noun",
        "role": "document",
        "aka": [
          "NACT",
          "NACT case",
          "N.I. Act case type"
        ],
        "sourceNotes": [
          "hr-filing-assistant-2026-06"
        ]
      },
      {
        "word": "Memo of parties",
        "gloss": "The list of the parties to the case - the complainant and each respondent with their address and phone number - filed as part of the complaint set. It is a mandatory, scrutinised document; the filing assistant checks that the address and phone fields are present because they are needed for service and registration.",
        "source": "Standard pleading in the filed set; scrutinised at the filing window (Panchkula, PUCAR interview, June 2026)",
        "group": "Filing & records",
        "pos": "noun",
        "role": "document",
        "aka": [
          "memo of parties"
        ],
        "sourceNotes": [
          "hr-filing-assistant-2026-06"
        ]
      },
      {
        "word": "Offence remarks",
        "gloss": "A free-text field in the CIS filing form that the assistants use to park the jurisdictional police station, because the filing counter has no dedicated column for it. The police station is derived from the bank where the cheque was presented and is used to distribute NACT cases among the clerks - not for any investigation, since a s.138 case has no FIR.",
        "source": "Local CIS data-entry practice, Panchkula filing branch (PUCAR interview, June 2026) - a workaround for a missing field",
        "group": "Systems & records",
        "pos": "noun",
        "role": "procedure",
        "sourceNotes": [
          "hr-filing-assistant-2026-06"
        ]
      },
      {
        "word": "Filing window",
        "gloss": "The lower-court counter where advocates submit physical NACT files and the filing assistant receives, scrutinises and enters them. In Panchkula the window is open until 12:00 PM and files are processed the same day; it handles 40 to 50 files of all categories a day, of which up to about 10 are NACT.",
        "source": "Panchkula district courts filing branch (PUCAR interview, June 2026)",
        "group": "Filing & records",
        "pos": "noun",
        "role": "procedure",
        "aka": [
          "filing counter"
        ],
        "sourceNotes": [
          "hr-filing-assistant-2026-06"
        ]
      }
    ]
  },
  "story": {
    "summary": "How a s.138 (cheque bounce, 'NACT') case is filed in Haryana - from the advocate's submission at the Panchkula lower-court filing window through scrutiny, CIS entry and same-day dispatch to the trial court. Based on a June 2026 field interview with the filing assistants; it covers the filing and scrutiny stage, not yet the full trial journey.",
    "process": {
      "summary": "The filing spine at the Panchkula lower-court window - receive, scrutinise, enter in CIS, register and dispatch the same day. The procedure is the uniform e-Courts CIS flow; the local colour is in the scrutiny checklist and a set of self-started workarounds.",
      "stages": [
        {
          "stage": "1 · Advocate submits the physical file",
          "id": "file-submission",
          "steps": [
            {
              "t": "The advocate submits the NACT file at the lower-court filing window (open until 12:00 PM); the filing assistant receives it."
            },
            {
              "t": "The file is assembled in a fixed order: CIS proforma pasted on the cover and a second CIS proforma inside, then the index, the memo of parties, the application (the complaint, its 'prayer'), a Rs.10 court-fee ticket, an attested affidavit, the cheque (laminated), an attested power of attorney, and one full copy of the file per respondent.",
              "c": [
                {
                  "l": "NI Act §138",
                  "n": "ni:sec_138"
                }
              ]
            }
          ]
        },
        {
          "stage": "2 · Scrutiny at the window",
          "id": "filing-scrutiny",
          "steps": [
            {
              "t": "The assistant scrutinises the file: CIS proforma pasted outside and present inside; index filled; pagination done; memo of parties carries address and phone; age recorded (treated as critical); every page signed and attested by the advocate for genuineness."
            },
            {
              "t": "Mandatory supporting documents are checked - the cheque, the memo of parties and the legal notice - and the rest are verified against the list of documents in the index."
            },
            {
              "t": "Limitation is checked; if the filing looks delayed the assistant tells the advocate verbally to attach a delay-condonation application (IA). The clerks use a rule of thumb of '45 days'; the statutory position is one month from the cause of action.",
              "c": [
                {
                  "l": "NI Act §142",
                  "n": "ni:sec_142"
                }
              ]
            }
          ]
        },
        {
          "stage": "3 · CIS entry and numbering",